{
  "attestation": {
    "backendName": "noop",
    "certChainPem": "-----BEGIN CERTIFICATE-----\nNOOP-BACKEND-DETERMINISTIC-65a74b78fcbf14c3cf18f446b72af485\n-----END CERTIFICATE-----\n",
    "predicate": {},
    "predicateType": "https://primitivehub.ai/context-ci/v0.1/Attestation",
    "rekorInclusionProofJson": "{\"checkpoint\":{\"envelope\":\"noop checkpoint for 65a74b78fcbf14c3\"},\"hashes\":[],\"logIndex\":1705462648,\"rootHash\":\"65a74b78fcbf14c3cf18f446b72af4854d67ef8b17ab2b88736e78f4f56ed3b0\",\"treeSize\":1705462649}",
    "rekorLogId": "2e47e8866d56b3144c0d1e8a66a2db7e8863c619c2339561bd929ae94c834845",
    "rekorLogIndex": 1705462648,
    "signatureB64": "NjVhNzRiNzhmY2JmMTRjM2NmMThmNDQ2YjcyYWY0ODU0ZDY3ZWY4YjE3YWIyYjg4NzM2ZTc4ZjRmNTZlZDNiMA==",
    "signedAt": "2026-05-31T00:00:00+00:00",
    "statementB64": "Ch9odHRwczovL2luLXRvdG8uaW8vU3RhdGVtZW50L3YxElsKDW5vLWRldGFpbC11cmwaSgoGc2hhMjU2EkBlZjljODY2YmM4ZmRjMjYyNjRkOTRjZDU5NTFkYzIwNzcwMWJmY2Q3ZjEwZThlOTAwYmI4MGNiYjdjYzdlMDdiGjNodHRwczovL3ByaW1pdGl2ZWh1Yi5haS9jb250ZXh0LWNpL3YwLjEvQXR0ZXN0YXRpb24=",
    "verifyUrl": "noop://entry/1705462648"
  },
  "bundleVersion": "0.1",
  "content": {
    "bytesB64": "IyBOb0RldGFpbAo=",
    "mediaType": "text/markdown; charset=utf-8",
    "sizeBytes": 11
  },
  "subject": {
    "contentDigest": "sha256:ef9c866bc8fdc26264d94cd5951dc207701bfcd7f10e8e900bb80cbb7cc7e07b",
    "semver": "1.0.0",
    "slug": "no-detail-url"
  }
}
