{
  "attestation": {
    "backendName": "noop",
    "certChainPem": "-----BEGIN CERTIFICATE-----\nNOOP-BACKEND-DETERMINISTIC-8317998b49c7cd1a4fc85ae61e920cd1\n-----END CERTIFICATE-----\n",
    "predicate": {},
    "predicateType": "https://primitivehub.ai/context-ci/v0.1/Attestation",
    "rekorInclusionProofJson": "{\"checkpoint\":{\"envelope\":\"noop checkpoint for 8317998b49c7cd1a\"},\"hashes\":[],\"logIndex\":2199361931,\"rootHash\":\"8317998b49c7cd1a4fc85ae61e920cd11422c0b75d4bb2dbe360d086e0ad2064\",\"treeSize\":2199361932}",
    "rekorLogId": "ce8d81c03a574f9e674fda67eccb6fff503c213da7785ac1b82d8d6b8725683d",
    "rekorLogIndex": 2199361931,
    "signatureB64": "ODMxNzk5OGI0OWM3Y2QxYTRmYzg1YWU2MWU5MjBjZDExNDIyYzBiNzVkNGJiMmRiZTM2MGQwODZlMGFkMjA2NA==",
    "signedAt": "2026-05-31T00:00:00+00:00",
    "statementB64": "Ch9odHRwczovL2luLXRvdG8uaW8vU3RhdGVtZW50L3YxEl8KEXVuaWNvZGUtcHJpbWl0aXZlGkoKBnNoYTI1NhJAYjZiMjk3YTUxZDcwOGYwZTNlNTdkYTU2MTM5MTFjOTk0NzBjOTM1OGZjMmFhNGM2YzYzZmI1NzBlODhjMGY0MxozaHR0cHM6Ly9wcmltaXRpdmVodWIuYWkvY29udGV4dC1jaS92MC4xL0F0dGVzdGF0aW9u",
    "verifyUrl": "noop://entry/2199361931"
  },
  "bundleVersion": "0.1",
  "content": {
    "bytesB64": "IyBVbmljb2RlCgpNaXhlZCBzY3JpcHRzOiDOsc6yzrMgw7Eg5Lit5paHIPCflJAK",
    "mediaType": "text/markdown; charset=utf-8",
    "sizeBytes": 48
  },
  "detailUrl": "/primitive/unicode-primitive?version=0.1.0",
  "subject": {
    "contentDigest": "sha256:b6b297a51d708f0e3e57da5613911c99470c9358fc2aa4c6c63fb570e88c0f43",
    "semver": "0.1.0",
    "slug": "unicode-primitive"
  }
}
